"id","program_id","donor_name","amount","message","created_at","user_id","donor_email","payment_status","midtrans_order_id","midtrans_transaction_id"
"2","4","Ahmad Fadillah","500000","Semoga bermanfaat untuk saudara-saudara kita yang membutuhkan. Barakallahu fiikum.","""2026-03-08T07:19:56.307Z""",,,"pending",,
"3","4","Hamba Allah","100000","Lillahi ta'ala, semoga Allah memudahkan urusan mereka.","""2026-03-08T07:19:56.311Z""",,,"pending",,
"4","4","Siti Aminah","250000","Ya Allah, terimalah sedekah ini dan jadikanlah pemberat timbangan amal kebaikan kami.","""2026-03-08T07:19:56.315Z""",,,"pending",,
"5","4","Muhammad Rizki","1000000","Semoga menjadi amal jariyah yang tidak terputus pahalanya.","""2026-03-08T07:19:56.319Z""",,,"pending",,
"6","4","Hamba Allah","50000",,"""2026-03-08T07:19:56.323Z""",,,"pending",,
"7","5","Fatimah Az-Zahra","2000000","Untuk adik-adik yatim, tetap semangat menuntut ilmu. Semoga Allah mudahkan jalan kalian.","""2026-03-08T07:19:56.327Z""",,,"pending",,
"8","5","Keluarga Besar Hasan","5000000","Semoga ilmu yang didapat menjadi berkah dunia dan akhirat.","""2026-03-08T07:19:56.331Z""",,,"pending",,
"9","5","Hamba Allah","300000","Allahumma baarik lahum fii ilmihim.","""2026-03-08T07:19:56.334Z""",,,"pending",,
"10","6","Umar Hakim","1500000","Semoga sumur ini menjadi amal jariyah yang terus mengalir pahalanya.","""2026-03-08T07:19:56.337Z""",,,"pending",,
"11","6","Aisyah Putri","750000","Ya Allah, jadikanlah air ini sumber keberkahan bagi mereka.","""2026-03-08T07:19:56.340Z""",,,"pending",,
"12","6","Hamba Allah","200000",,"""2026-03-08T07:19:56.342Z""",,,"pending",,
"13","4","Test Donatur","50000","Test donasi Midtrans","""2026-03-08T09:42:36.712Z""",,"test@example.com","pending","DONATION-1772962956711-xbb6fl",
"14","4","Tester Midtrans","50000","Semoga bermanfaat","""2026-03-08T09:43:40.455Z""",,"tester@example.com","pending","DONATION-1772963020453-pkzfso",